{"$schema":"https://json-schema.org/draft/2020-12/schema","title":"ExternalPackageOpenReport","type":"object","required":["report_version","contract_version","package_identity","package_kind","open_result","reason_codes","manifest_valid","path_safety_valid","required_artifacts_total","required_artifacts_present","optional_artifacts_total","artifact_checksum_pass_count","artifact_checksum_fail_count","artifact_size_pass_count","artifact_size_fail_count","external_reference_count","external_reference_checked_count","package_complete","source_mutation_count","package_mutation_count","forbidden_field_count","absolute_path_count","path_escape_count","hardware_validation","replay_evaluated","limitations"],"properties":{"report_version":{"type":"string","enum":["external-package-open-report-v1"]},"contract_version":{"type":"string","enum":["p7.3-package-open-v1"]},"package_identity":{"type":["string","null"],"pattern":"^[0-9a-f]{64}$"},"package_kind":{"type":["string","null"],"enum":["self_contained","metadata_only","referenced_external","hybrid",null]},"open_result":{"type":"string","enum":["not_attempted","opened","opened_reference_only","blocked","invalid","unsupported"]},"reason_codes":{"type":"array","uniqueItems":true,"items":{"type":"string","enum":["ERR_PACKAGE_MANIFEST_MISSING","ERR_PACKAGE_MANIFEST_UNREADABLE","ERR_PACKAGE_MANIFEST_INVALID","ERR_PACKAGE_CONTRACT_VERSION_UNSUPPORTED","ERR_PACKAGE_KIND_UNSUPPORTED","ERR_PACKAGE_ABSOLUTE_PATH","ERR_PACKAGE_PATH_TRAVERSAL","ERR_PACKAGE_SYMLINK_FORBIDDEN","ERR_PACKAGE_PATH_DUPLICATE","ERR_PACKAGE_PATH_NORMALIZATION","ERR_PACKAGE_REQUIRED_ARTIFACT_MISSING","ERR_PACKAGE_ARTIFACT_SIZE_MISMATCH","ERR_PACKAGE_ARTIFACT_CHECKSUM_MISMATCH","ERR_PACKAGE_ARTIFACT_ID_DUPLICATE","ERR_PACKAGE_ARTIFACT_KIND_UNSUPPORTED","ERR_PACKAGE_UNDECLARED_ARTIFACT","ERR_PACKAGE_ZERO_BYTE_REQUIRED_ARTIFACT","ERR_PACKAGE_IDENTITY_MISMATCH","ERR_SOURCE_IDENTITY_MISMATCH","ERR_CONFIGURATION_IDENTITY_MISMATCH","ERR_COMPARISON_PROFILE_IDENTITY_MISSING","ERR_EXTERNAL_REFERENCE_UNAVAILABLE","ERR_EXTERNAL_REFERENCE_IDENTITY_MISSING","ERR_EXTERNAL_REFERENCE_CHECKSUM_MISSING","ERR_EXTERNAL_REFERENCE_LICENSE_BLOCKED","ERR_PACKAGE_FORBIDDEN_FIELD","ERR_PACKAGE_SECRET_DETECTED","ERR_PACKAGE_PII_DETECTED","ERR_PACKAGE_ARCHIVE_UNSUPPORTED","ERR_PACKAGE_SIZE_LIMIT","ERR_PACKAGE_ARTIFACT_COUNT_LIMIT","ERR_PACKAGE_MANIFEST_SIZE_LIMIT","ERR_PACKAGE_CHECKSUM_ALGORITHM_UNSUPPORTED","ERR_PACKAGE_ARTIFACT_IDENTITY_MISMATCH","ERR_COMPARISON_PROFILE_IDENTITY_MISMATCH","ERR_PACKAGE_SOURCE_MUTATION","ERR_PACKAGE_MUTATION","ERR_EXTERNAL_REFERENCE_ID_DUPLICATE","ERR_EXTERNAL_REFERENCE_IDENTITY_MISMATCH","ERR_PACKAGE_SPECIAL_FILE","ERR_PACKAGE_HARDLINK_FORBIDDEN"]}},"manifest_valid":{"type":"boolean"},"path_safety_valid":{"type":"boolean"},"required_artifacts_total":{"type":"integer","minimum":0},"required_artifacts_present":{"type":"integer","minimum":0},"optional_artifacts_total":{"type":"integer","minimum":0},"artifact_checksum_pass_count":{"type":"integer","minimum":0},"artifact_checksum_fail_count":{"type":"integer","minimum":0},"artifact_size_pass_count":{"type":"integer","minimum":0},"artifact_size_fail_count":{"type":"integer","minimum":0},"external_reference_count":{"type":"integer","minimum":0},"external_reference_checked_count":{"type":"integer","minimum":0},"package_complete":{"type":"boolean"},"source_mutation_count":{"type":"integer","minimum":0},"package_mutation_count":{"type":"integer","minimum":0},"forbidden_field_count":{"type":"integer","minimum":0},"absolute_path_count":{"type":"integer","minimum":0},"path_escape_count":{"type":"integer","minimum":0},"hardware_validation":{"type":"boolean","const":false,"enum":[false]},"replay_evaluated":{"type":"boolean","const":false,"enum":[false]},"limitations":{"type":"array","uniqueItems":true,"items":{"type":"string"}}},"additionalProperties":false}
