{"absolute_path_count":0,"artifact_checksum_fail_count":0,"artifact_checksum_pass_count":1,"artifact_size_fail_count":0,"artifact_size_pass_count":1,"contract_version":"p7.3-package-open-v1","external_reference_checked_count":0,"external_reference_count":0,"forbidden_field_count":0,"hardware_validation":false,"limitations":["No semantic replay."],"manifest_valid":true,"open_result":"opened","optional_artifacts_total":0,"package_complete":true,"package_identity":"6853e36276ed9fe26e7db68c309ce612207bdfbf6c97f336e17b50b48715c3ab","package_kind":"self_contained","package_mutation_count":0,"path_escape_count":0,"path_safety_valid":true,"reason_codes":[],"replay_evaluated":false,"report_version":"external-package-open-report-v1","required_artifacts_present":1,"required_artifacts_total":1,"source_mutation_count":0}
